id,type,date,description
DISAPPEAR,Last Sighting/Disappearance,1996-05-25 02:00:00,"Kristin was last seen with Paul Flores near his dorm."
DECLARE_DEAD,Legally Declared Dead,2002-05-25,"Declared dead on the 6th anniversary of her disappearance."
DIG_2016,Cal Poly Excavation,2016-09-06,"Sheriff's Office and FBI dug on Cal Poly hillside."
SEARCH_RF_HOME,Search Warrant (Ruben Flores),2021-03-15,"Cadaver dogs and GPR used under the deck."
ARRESTS,Arrests of Flores,2021-04-13,"Paul charged with Murder, Ruben charged with Accessory."
TRIAL_START,Trial Commencement,2022-07-18,"Trial started in Monterey County after venue change."
PF_GUILTY,Paul Flores Verdict,2022-10-18,"Paul Flores found Guilty of First-Degree Murder."
